<?xml version="1.0" encoding="UTF-8"?>
<!ELEMENT continente (#PCDATA)>
<!ELEMENT  pais (#PCDATA)>
<!ATTLIST pais
    nombrePais ID #REQUIRED>
<!ELEMENT capital (#PCDATA)>
<!ELEMENT lugar (continente*, pais*,capital*)>
<!ELEMENT tierra (lugar*)>

